"TITLE (ORIGINAL)","TITLE (STANDARD)"
"DIR OF ADMIN & EXTERNAL AFFAIR","DIRECTOR OF ADMINISTRATIVE AND EXTERNAL AFFAIR  "
"DIR OF COALITIONS AND GENERAL COUN","DIRECTOR OF COALITIONS/GENERAL COUNSEL  "
"DIR OF COMM DEV.","DIRECTOR OF COMMUNICATION DEVELOPMENT  "
"DIR OF COMMUNCTNS & SPEC PROJE","DIRECTOR OF COMMUNICATIONS AND SPECIALIST PROJECTS  "
"DIR OF CONSTITUENT RELATIONS","DIRECTOR OF CONSTITUENT RELATIONS  "
"DIR OF EDU & HUMAN SERV POLICY","DIRECTOR OF EDUCATION AND HUMAN SERVICES POLICY  "
"DIR OF GOV BUS & COMMUN AFFAIR","DIRECTOR OF GOVERNMENT BUS AND COMMUNICATIONS AFFAIR  "
"DIR OF INFO TECHNOLOGY-F.C.","DIRECTOR OF INFORMATION TECHNOLOGY-FULL COMMITTEE  "
"DIR OF INFOR SVCS","DIRECTOR OF INFORMATION SERVICES  "
"DIR OF LEGISLATION & COMMUNICA","DIRECTOR OF LEGISLATION AND COMMUNICATIONS  "
"DIR OF MBR OUTREACH-VICE CHAIR","DIRECTOR OF MEMBER OUTREACH-VICE CHAIR  "
"DIR OF MULTIMEDIA COMM AND TEC","DIRECTOR OF MULTIMEDIA COMMUNICATION AND TEC  "
"DIR OF POLICY & OUTREACH-F.C.","DIRECTOR OF POLICY AND OUTREACH-FULL COMMITTEE  "
"DIR OF SCHEDLNG & SPEC EVENTS","DIRECTOR OF SCHEDLNG AND SPECIALIST EVENTS  "
"DIR OF SCHEDULING & NEW MEDIA","DIRECTOR OF SCHEDULING AND NEW MEDIA  "
"DIR OF SPEC PROJ AND FLD REP","DIRECTOR OF SPECIALIST PROJECT AND FIELD DIRECTOR REPRESENTATIVE  "
"DIR PROJECTS & OUTREACH","DIRECTOR PROJECTS AND OUTREACH  "
"DIR SPECIAL PROJ. AND MEMBER SERV.","DIRECTOR SPECIAL PROJECTS/MEMBER SERVICES  "
"DIR, DIST PLANNING & OUTREACH","DIRECTOR, DISTRICT PLANNING AND OUTREACH  "
"DIR, IDENTIFICATION SERVICES","DIRECTOR, IDENTIFICATION SERVICES  "
"DIR, INFO SYSTEMS AUDITS","DIRECTOR, INFORMATION SYSTEMS AUDITS  "
"DIR, INFOSYS, QUALITY & CONTR","DIRECTOR, INFOSYS, QUALITY AND CONTR  "
"DIR, OFFICE OF EMPLOYEE ASSIST","DIRECTOR, OFFICE OF EMPLOYEE ASSISTANT  "
"DIR, OFFICE OF MEM & COMM SRVC","DIRECTOR, OFFICE OF MEMBER AND COMMUNICATION SERVICES  "
"DIR, PERFORMANCE & FIN AUDITS","DIRECTOR, PERFORMANCE AND FINANCIAL AUDITS  "
"DIR. INTRAGOVERNMENT RELATIONS","DIRECTOR INTRAGOVERNMENT RELATIONS  "
"DIR. MIL & INTEL AFRS AND DIST DIR","DIRECTOR MILITARY AND INTELLIGENCE AFFAIRS/DISTRICT DIRECTOR  "
"DIR. OF CONSTITUENT AFFAIRS","DIRECTOR OF CONSTITUENT AFFAIRS  "
"DIR. OF FINANCIAL DISC. REVIEW","DIRECTOR OF FINANCIAL DISCLOSURE REVIEW  "
"DIR. OF LEGISLATIVE OPERATIONS","DIRECTOR OF LEGISLATIVE OPERATIONS  "
"DIR. OFFICE SUPPLY & GIFT SHOP","DIRECTOR OFFICE SUPPLY AND GIFT SHOP  "
"DIR., SYSTEMS AND OPERATIONS","DIRECTOR, SYSTEMS AND OPERATIONS  "
"DIR.MEM.SERV AND SR. ADV","DIRECTOR MEMBER SERVICES/SENIOR  ADVISOR  "
"DIRECTOR BUDGET POLICY","DIRECTOR BUDGET POLICY  "
"DIRECTOR BUSINESS CONTINUITY","DIRECTOR BUSINESS CONTINUITY  "
"DIRECTOR ENTERPRISE OPERATIONS","DIRECTOR ENTERPRISE OPERATIONS  "
"DIRECTOR FACILITIES MANAGEMENT","DIRECTOR FACILITIES MANAGEMENT  "
"DIRECTOR FINANCIAL SOLUTIONS","DIRECTOR FINANCIAL SOLUTIONS  "
"DIRECTOR FURNISHINGS","DIRECTOR FURNISHINGS  "
"DIRECTOR MEMBERS’ SERVICES","DIRECTOR MEMBERS' SERVICES  "
"DIRECTOR OF ADMIN AND SCHEDULER","DIRECTOR OF ADMIN/SCHEDULER  "
"DIRECTOR OF BUDGET REVIEW","DIRECTOR OF BUDGET REVIEW  "
"DIRECTOR OF CASEWORK","DIRECTOR OF CASEWORK  "
"DIRECTOR OF COALITIONS","DIRECTOR OF COALITIONS  "
"DIRECTOR OF COMM FACILITIES AND TV","DIRECTOR OF COMMUNICATION FACILITIES/TV  "
"DIRECTOR OF CONSTITUENT CORRE","DIRECTOR OF CONSTITUENT CORRE  "
"DIRECTOR OF CONSTITUTENT SVCS","DIRECTOR OF CONSTITUTENT SERVICES  "
"DIRECTOR OF DISTRICT RELATIONS","DIRECTOR OF DISTRICT RELATIONS  "
"DIRECTOR OF EXTERNAL RELATIONS","DIRECTOR OF EXTERNAL RELATIONS  "
"DIRECTOR OF FLOOR OPERATIONS","DIRECTOR OF FLOOR OPERATIONS  "
"DIRECTOR OF FLOOR OPS","DIRECTOR OF FLOOR OPERATIONS  "
"DIRECTOR OF IMMIGRATION AFFAIR","DIRECTOR OF IMMIGRATION AFFAIR  "
"DIRECTOR OF INFORMATION TECHNO","DIRECTOR OF INFORMATION TECHNO  "
"DIRECTOR OF INTERNET COMMS","DIRECTOR OF INTERNET COMMUNICATIONS  "
"DIRECTOR OF LEGISLATIVE AFFAIR","DIRECTOR OF LEGISLATIVE AFFAIR  "
"DIRECTOR OF ONLINE COMMUNICA","DIRECTOR OF ONLINE COMMUNICATIONS  "
"DIRECTOR OF OPS AND EXECUTIVE ASST","DIRECTOR OF OPERATIONS/EXECUTIVE ASSISTANT  "
"DIRECTOR OF PERSONNEL","DIRECTOR OF PERSONNEL  "
"DIRECTOR OF PROJECTS","DIRECTOR OF PROJECTS  "
"DIRECTOR OF PROTOCOL","DIRECTOR OF PROTOCOL  "
"DIRECTOR OF PUBLIC AFFAIRS","DIRECTOR OF PUBLIC AFFAIRS  "
"DIRECTOR OF PUBLIC RELATIONS","DIRECTOR OF PUBLIC RELATIONS  "
"DIRECTOR OF RESEARCH","DIRECTOR OF RESEARCH  "
"DIRECTOR OF SCHEDULING AND OUTREAC","DIRECTOR OF SCHEDULING/OUTREAC  "
"DIRECTOR OF SPECIAL OPERATIONS","DIRECTOR OF SPECIAL OPERATIONS  "
"DIRECTOR OF STRATEGIC PLANNING","DIRECTOR OF STRATEGIC PLANNING  "
"DIRECTOR OF WEB COMMUNICATIONS","DIRECTOR OF WEB COMMUNICATIONS  "
"DIRECTOR OF WORKFORCE POLICY","DIRECTOR OF WORKFORCE POLICY  "
"DIRECTOR PAYROLL AND BENEFITS","DIRECTOR PAYROLL AND BENEFITS  "
"DIRECTOR SENIOR CITIZEN AFFAIR","DIRECTOR SENIOR CITIZEN AFFAIR  "
"DIRECTOR TECH SUPPORT","DIRECTOR TECHNICAL SUPPORT  "
"DIRECTOR, ADMIN & OPERATIONS","DIRECTOR, ADMINISTRATIVE AND OPERATIONS  "
"DIRECTOR, ASIAN COMM RELATIONS","DIRECTOR, ASIAN COMMUNICATION RELATIONS  "
"DIRECTOR, LOGISTICS","DIRECTOR, LOGISTICS  "
"DIRECTOR, SPECIAL EVENTS AND PROTO","DIRECTOR, SPECIAL EVENTS/PROTO  "
"DIRECTOR, SPECIAL PROJECTS","DIRECTOR, SPECIAL PROJECTS  "
"DIRECTOR, TRAINING & DEVLOPMEN","DIRECTOR, TRAINING AND DEVLOPMEN  "
"DIRECTOR, WOUNDED WARRIOR PGM","DIRECTOR, WOUNDED WARRIOR PGM  "
"DIRECTOR AND ECONOMIC DEVELOPMENT","DIRECTOR/ECONOMIC DEVELOPMENT  "
"DIRECTOR-HOUSE CHILD CARE CNTR","DIRECTOR-HOUSE CHILD DIRECTOR CARE CENTER  "
"DIR-HOUSE RECORDING STUDIO","DIRECTOR-HOUSE RECORDING STUDIO  "
"DIR-PROCUREMENT MANAGEMENT","DIRECTOR-PROCUREMENT MANAGEMENT  "
"DISRICT SENIOR POLICY ADVISOR","DISTRICT SENIOR POLICY ADVISOR  "
"DIST AIDE-PERSONNEL AND BUDGET DIR","DISTRICT AIDE-PERSONNEL/BUDGET DIRECTOR  "
"DIST COORDINATOR EAST REGION","DISTRICT COORDINATOR EAST REGION  "
"DIST DIR OF CONSTIT SVCS","DISTRICT DIRECTOR OF CONSTITUENT SERVICES  "
"DIST DIR, MILITARY AFFAIRS","DISTRICT DIRECTOR, MILITARY AFFAIRS  "
"DIST DIR AND COMMUNITY OUTRCH DIR","DISTRICT DIRECTOR/COMMUNITY OUTRCH DIRECTOR  "
"DIST FIELD REP AND VET AFFRS","DISTRICT FIELD DIRECTOR REPRESENTATIVE AND VETERAN AFFAIRS  "
"DIST OFFICE SCHEDULER AND COMM REL","DISTRICT OFFICE SCHEDULER/COMMUNITY RELATIONS  "
"DIST OPERATIONS DIRECTOR","DISTRICT OPERATIONS DIRECTOR  "
"DIST OUTREACH REPRESENTATIVE","DISTRICT OUTREACH REPRESENTATIVE  "
"DIST PRESS SECY","DISTRICT PRESS SECRETARY  "
"DIST REP-KALAMAZOO AND DIST ADMIN","DISTRICT REPRESENTATIVE-KALAMAZOO/DISTRICT ADMINISTRATIVE  "
"DIST SCHEDULER AND REP","DISTRICT SCHEDULER/REPRESENTATIVE  "
"DIST. SCHEDULER AND CONG. AIDE","DISTRICT SCHEDULER/CONGRESSMAN AIDE  "
"DISTRICT & COMMUNICATIONS DIR","DISTRICT AND COMMUNICATIONS DIRECTOR  "
"DISTRICT ADMINISTRATIVE ASSIST","DISTRICT ADMINISTRATIVE ASSISTANT  "
"DISTRICT ADVISOR","DISTRICT ADVISOR  "
"DISTRICT AIDE AND PRESS ASSISTANT","DISTRICT AIDE/PRESS ASSISTANT  "
"DISTRICT AIDE AND PRESS SECRETARY","DISTRICT AIDE/PRESS SECRETARY  "
"DISTRICT ASST AND CASE MANAGER","DISTRICT ASSISTANT/CASE MANAGER  "
"DISTRICT CASEWORKER AND OFFICE MAN","DISTRICT CASEWORKER/OFFICE MANAGER  "
"DISTRICT CHIEF OF STAFF AND AA","DISTRICT CHIEF OF STAFF/ADMINISTRATIVE ASSISTANT  "
"DISTRICT COMMUNIATIONS & OUTRE","DISTRICT COMMUNIATIONS AND OUTRECH "
"DISTRICT CONSTITUENT ADVOCATE","DISTRICT CONSTITUENT ADVOCATE  "
"DISTRICT COORD. POINTS REGION","DISTRICT COORDINATOR POINTS REGION  "
"DISTRICT COUNSELOR","DISTRICT COUNSELOR  "
"DISTRICT DEPUTY DIRECTOR","DISTRICT DEPUTY DIRECTOR  "
"DISTRICT DIR - FIELD SERVICES","DISTRICT DIRECTOR - FIELD DIRECTOR SERVICES  "
"DISTRICT DIR & DEPUTY C.O.S","DISTRICT DIRECTOR AND DEPUTY C.O.S  "
"DISTRICT DIR, DEPUTY C.O.S","DISTRICT DIRECTOR, DEPUTY C.O.S  "
"DISTRICT DIR. - JEFFERSON CO","DISTRICT DIRECTOR - JEFFERSON CO  "
"DISTRICT DIRECTOR (OTHER COMPENSATION)","DISTRICT DIRECTOR   "
"DISTRICT DIRECTOR-NEW MEXICO","DISTRICT DIRECTOR-NEW MEXICO  "
"DISTRICT FIELD CORRDINATOR","DISTRICT FIELD DIRECTOR CORRDINATOR  "
"DISTRICT LIAISON AND FIELD REP","DISTRICT LIAISON/FIELD DIRECTOR REPRESENTATIVE  "
"DISTRICT LIAISON AND LOGIST DIR","DISTRICT LIAISON/LOGIST DIRECTOR  "
"DISTRICT OFFICE ASSISTANT","DISTRICT OFFICE ASSISTANT  "
"DISTRICT OFFICE COORDINATOR","DISTRICT OFFICE COORDINATOR  "
"DISTRICT OFFICE OF STAFF","DISTRICT OFFICE OF STAFF  "
"DISTRICT OUTREACH DIRECTOR","DISTRICT OUTREACH DIRECTOR  "
"DISTRICT PRESS SECRETARY","DISTRICT PRESS SECRETARY  "
"DISTRICT PROJECT MANAGER","DISTRICT PROJECT MANAGER  "
"DISTRICT PROJECTS MANAGER","DISTRICT PROJECTS MANAGER  "
"DISTRICT RECEPTIONIST","DISTRICT RECEPTIONIST  "
"DISTRICT REP. AND POLICY LIAISON","DISTRICT REPRESENTATIVE / POLICY LIAISON  "
"DISTRICT REP AND SCHEDULER","DISTRICT REPRESENTATIVE/SCHEDULER  "
"DISTRICT REP-OUTREACH","DISTRICT REPRESENTATIVE-OUTREACH  "
"DISTRICT SCHED AND EA AND CASEWORKER","DISTRICT SCHED/EA/CASEWORKER  "
"DISTRICT SCHEDULER AND EXEC ASSIST","DISTRICT SCHEDULER/EXECUTIVE ASSISTANT  "
"DISTRICT SCHEDULER AND FIELD REP","DISTRICT SCHEDULER/FIELD DIRECTOR REPRESENTATIVE  "
"DISTRICT SCHEDULER AND STAFF ASSIS","DISTRICT SCHEDULER/STAFF ASSIS  "
"DISTRICT SPECIAL ASSISTANT","DISTRICT SPECIAL ASSISTANT  "
"DOCUMENT PRODUCTION SPECIALST","DOCUMENT PRODUCTION SPECIALST  "
"DOCUMENTS CLERK","DOCUMENTS CLERK  "
"DOWNRIVER COORDINATOR","DOWNRIVER COORDINATOR  "
"DPTY CHIEF OF STAFF AND COMMUNICA","DEPUTY CHIEF OF STAFF/COMMUNICATIONS  "
"DPTY CHIEF OF STF AND DIST DIR","DEPUTY CHIEF OF STAFF/DISTRICT DIRECTOR  "
"EA AND SCHEDULER","EA/SCHEDULER  "
"ECON DEVELOPMENT REP","ECONOMIC DEVELOPMENT REPRESENTATIVE  "
"ECONOMIC DEVELOPMENT SPECIALIS","ECONOMIC DEVELOPMENT SPECIALIS  "
"ED OUTREACH COOR AND OFF MANAGER","EDUCATION OUTREACH COORDINATOR/OFF MANAGER  "
"EDITOR & PRINTER","EDITOR AND PRINTER  "
"EDITOR (P)","EDITOR   "
"EDITOR AND DOCUMENT CLERK","EDITOR/DOCUMENT CLERK  "
"EDUCATION POLCY ADVIS FOR SUBC","EDUCATION POLCY ADVISOR FOR SUBCOMMITTEE  "
"EDUCATION POLICY ASSOCIATE","EDUCATION POLICY ASSOCIATE  "
"EDUCATION POLICY COUNSEL","EDUCATION POLICY COUNSEL  "
"ENERGY ADVISOR","ENERGY ADVISOR  "
"ENGINEERING OPS MANAGER","ENGINEERING OPERATIONS MANAGER  "
"ENTERP STORAGE SYS BRANCH MGR","ENTERP STORAGE SYSTEMS BRANCH MANAGER  "
"ENTERP TECHNOL SYS BRANCH MGR","ENTERP TECHNOL SYSTEMS BRANCH MANAGER  "
"ENVIRONMENTAL LEGISLATIVE ASSI","ENVIRONMENTAL LEGISLATIVE ASSISTANT  "
"EVENTS AND PROJECTS COORDINATO","EVENTS AND PROJECTS COORDINATOR "
"EVERETT CASE WORKER","EVERETT CASE WORKER  "
"EXEC ASSIST AND SCHEDULER","EXECUTIVE ASSISTANT/SCHEDULER  "
"EXEC ASSISTANT AND DC SCHEDULER","EXECUTIVE ASSISTANT/DC SCHEDULER  "
"EXEC ASSISTANT AND OFFICE MANAGER","EXECUTIVE ASSISTANT/OFFICE MANAGER  "
"EXEC ASST AND DISTRICT SCHEDULER","EXECUTIVE ASSISTANT/DISTRICT SCHEDULER  "
"EXEC ASST AND NATO POLICY ADVISOR","EXECUTIVE ASSISTANT/NATO POLICY ADVISOR  "
"EXEC DIRECTOR- IRC","EXECUTIVE DIRECTOR- IRC  "
"EXECUTIVE ADMINISTRATOR (OVERTIME)","EXECUTIVE ADMINISTRATOR   "
"EXECUTIVE ASSISTANT AND OFC MGR","EXECUTIVE ASSISTANT/OFFICE MANAGER  "
"EXECUTIVE ASSISTANT AND PRESS SECR","EXECUTIVE ASSISTANT/PRESS SECRETARY  "
"EXECUTIVE ASST OFFICE MANAGER","EXECUTIVE ASSISTANT OFFICE MANAGER  "
"EXECUTIVE ASST AND LEGIS AIDE","EXECUTIVE ASSISTANT/LEGISLATIVE AIDE  "
"EXECUTIVE DIR, WESTERN CAUCUS","EXECUTIVE DIRECTOR, WESTERN CAUCUS  "
"EXECUTIVE DIRECTOR AND W CAUCUS","EXECUTIVE DIRECTOR/WESTERN CAUCUS  "
"EXECUTIVE LEGIS ASSISTANT","EXECUTIVE LEGISLATIVE ASSISTANT  "
"EXECUTIVE SCHEDULER","EXECUTIVE SCHEDULER  "
"EXECUTIVE SECRETARY","EXECUTIVE SECRETARY  "
"EXECUTIVE SECRETARY AND SCHEDULER","EXECUTIVE SECRETARY/SCHEDULER  "
"EXECUTIVE STAFF ASSISTANT","EXECUTIVE STAFF ASSISTANT  "
"EXECUTIVE AND PRESS ASSISTANT","EXECUTIVE/PRESS ASSISTANT  "
"FACILITIES MANAGEMENT SPECIALI","FACILITIES MANAGEMENT SPECIALIST  "
"FAYETTEVILLE OFC MGR AND CONSTIT","FAYETTEVILLEOFFICE MANAGER/CONSTITUENT  "
"FIELD ASSISTANT","FIELD DIRECTOR ASSISTANT  "
"FIELD COORDINATOR","FIELD DIRECTOR COORDINATOR  "
"FIELD DEPUTY AND CASEWORKER","FIELD DIRECTOR DEPUTY/CASEWORKER  "
"FIELD OFFICE REPRESENTATIVE","FIELD DIRECTOR OFFICE REPRESENTATIVE  "
"FIELD OUTREACH COORDINATOR","FIELD DIRECTOR OUTREACH COORDINATOR  "
"FIELD REP & SPEC PROJECTS COOR","FIELD DIRECTOR REPRESENTATIVE AND SPECIALIST PROJECTS COORDINATOR  "
"FIELD REP & SYS ADMIN","FIELD DIRECTOR REPRESENTATIVE AND SYSTEMS ADMINISTRATOR  "
"FIELD REP. AND CONSTITUENT SERVICE","FIELD DIRECTOR REPRESENTATIVE/CONSTITUENT SERVICE  "
"FIELD REP. AND FARMINGTON OFC., NM","FIELD DIRECTOR REPRESENTATIVE/FARMINGTON OFC., NM  "
"FIELD REP AND CHAUTAUQUA COUNTY","FIELD DIRECTOR REPRESENTATIVE/CHAUTAUQUA COUNTY  "
"FIELD REP AND COMMUNITY LIAISON","FIELD DIRECTOR REPRESENTATIVE/COMMUNITY LIAISON  "
"FIELD REP AND DIST OFC MANAGER","FIELD DIRECTOR REPRESENTATIVE/DISTRICTOFFICE MANAGER  "
"FIELD REP AND DISTRICT SCHEDULER","FIELD DIRECTOR REPRESENTATIVE/DISTRICT SCHEDULER  "
"FIELD REP AND OFFICE MANAGER","FIELD DIRECTOR REPRESENTATIVE/OFFICE MANAGER  "
"FIELD REP AND SR CITIZENS LIAISON","FIELD DIRECTOR REPRESENTATIVE/SENIOR CITIZENS LIAISON  "
"FIELD REP AND STAFF ASST","FIELD DIRECTOR REPRESENTATIVE/STAFF ASSISTANT  "
"FIELD REPRESENTATIVE AND CASE MGR","FIELD DIRECTOR REPRESENTATIVE/CASE MANAGER  "
"FIELD REPRESENTATIVE AND DISTRICT","FIELD DIRECTOR REPRESENTATIVE/DISTRICT  "
"FIELD AND CONSTIT OUTREACH SUPERVI","FIELD/CONSTITUENT OUTREACH SUPERVISOR  "
"FIELDWORKER","FIELD WORKER  "
"FINANCE ASSISTANT","FINANCE ASSISTANT  "
"FINANCIAL ADMIN. - REPUBLICAN","FINANCIAL ADMINISTRATOR - REPUBLICAN  "
"FINANCIAL ADMINISTRATOR AND SCHEDU","FINANCIAL ADMINISTRATOR/SCHEDULER "
"FINANCIAL AND ADMIN. OFFICER","FINANCIAL AND ADMINISTRATOR OFFICER  "
"FINANCIAL LEGISLATIVE ASST","FINANCIAL LEGISLATIVE ASSISTANT  "
"FINANCIAL MANAGER","FINANCIAL MANAGER  "
"FIRST ASSISTANT","FIRST ASSISTANT  "
"FLOOR ASSISTANT (STAT)","FLOOR ASSISTANT (STAT)  "
"FLOOR DIRECTOR","FLOOR DIRECTOR  "
"FLOOR DIRECTOR AND COUNSEL","FLOOR DIRECTOR AND COUNSEL  "
"FOREIGN AFFAIRS ADVISOR","FOREIGN AFFAIRS ADVISOR  "
"FULL COMMITTEE CLERK","FULL COMMITTEE CLERK  "
"FULL COMMITTEE COUNSEL","FULL COMMITTEE COUNSEL  "
"GALESBURG OFFICE DIRECTOR","GALESBURG OFFICE DIRECTOR  "
"GASTON COUNTY COORDINATOR","GASTON COUNTY COORDINATOR  "
"GEN COUNSEL & DEP STAFF DIREC","GENERAL COUNSEL AND DEPUTY STAFF DIRECTOR  "
"GEN. COUNSEL AND DIR. OF FLOOR OPS","GENERAL  COUNSEL/DIRECTOR OF FLOOR OPERATIONS  "
"GENERAL COUNSEL AND CHIEF COUNSEL","GENERAL COUNSEL/CHIEF COUNSEL  "
"GOV’T & COMMUNITY REL. LIAISON","GOVERNMENT AND COMMUNITY RELATIONS LIAISON  "
"GRANT ANALYST AND COMM LIA NONPROF","GRANT ANALYST/COMMUNICATION LIA NONPROFESSIONAL  "
"GRANTS & PROJECTS COORDINATOR","GRANTS AND PROJECTS COORDINATOR  "
"GRANTS ADMINISTRATOR","GRANTS ADMINISTRATOR  "
"GRANTS COORD AND COMMUN LIAISON","GRANTS COORDINATOR/COMMUNICATIONS LIAISON  "
"GRANTS DIRECTOR AND FIELD REP","GRANTS DIRECTOR/FIELD DIRECTOR REPRESENTATIVE  "
"GRANTS MANAGER","GRANTS MANAGER  "
"GRANTS MNGR AND COMM SVCS LIAISON","GRANTS MNGR/ COMMUNICATION SERVICES LIAISON  "
"GRAPHICS MANAGER","GRAPHICS MANAGER  "
"HARDWARE ENGINEER","HARDWARE ENGINEER  "
"HARDWARE ENGINEER (OVERTIME)","HARDWARE ENGINEER   "
"HEAD TEACHER","HEAD TEACHER  "
"HEALTH CARE COUNSEL","HEALTH CARE COUNSEL  "
"HEALTH COUNSEL","HEALTH COUNSEL  "
"HEALTH LEGISLATIVE ASSISTANT","HEALTH LEGISLATIVE ASSISTANT  "
"HEARING CLERK","HEARING CLERK  "
"HISTORIAN OF THE HOUSE","HISTORIAN OF THE HOUSE  "
"HOMELAND SECURITY ADVISOR","HOMELAND SECURITY ADVISOR  "
"HOMELAND SECURITY ASSISTANT","HOMELAND SECURITY ASSISTANT  "
"HOUSE PAGE RESIDENCE HALL DIR","HOUSE PAGE RESIDENCE HALL DIRECTOR  "
"HOUSE TECHNOLOGY DIRECTOR","HOUSE TECHNOLOGY DIRECTOR  "
"HOUSING SPEC. AND INTAKE DIR.","HOUSING SPECIALIST/INTAKE DIRECTOR  "
"HUMAN RESOURCES DIRECTOR","HUMAN RESOURCES DIRECTOR  "
"HUMAN RESOURCES STAFF DIRECTOR","HUMAN RESOURCES STAFF DIRECTOR  "
"HUMAN SVCS LIAISON CASEWKR","HUMAN SERVICES LIAISON CASEWORKER  "
"HUNTSVILLE CASEWORKER","HUNTSVILLE CASEWORKER  "
"HWY POLICY DIR-HWY TRANSIT SUB","HIGHWAY POLICY DIRECTOR-HIGHWAY TRANSIT SUBCOMMITTEE  "
"IMMIGRATION CASEWORKER","IMMIGRATION CASEWORKER  "
"IMMIGRATION SPECIALIST","IMMIGRATION SPECIALIST  "
"INFO SYSTEMS SECURITY MNGR","INFORMATION SYSTEMS SECURITY MANAGER  "
"INFORMATION RESOURCES MANAGER","INFORMATION RESOURCES MANAGER  "
"INFORMATION TECH ASST","INFORMATION TECHNICAL ASSISTANT  "
"INFORMATION TECHNOLOGY ASSIST","INFORMATION TECHNOLOGY ASSISTANT  "
"INFORMATION TECHNOLOGY SPECIAL","INFORMATION TECHNOLOGY SPECIAL  "
"INTERIM PRESS SECRETARY","INTERIM PRESS SECRETARY  "
"INTERIM PRESS SECRETARY (OVERTIME)","INTERIM PRESS SECRETARY   "
"INTERN COORDINATOR","INTERN COORDINATOR  "
"INTERNATIONAL AND IMMIGRATION SPEC","INTERNATIONAL/IMMIGRATION SPECIALIST  "
"INVENTORY ADMINISTRATOR","INVENTORY ADMINISTRATOR  "
"INVENTORY SPEC AND SPECIAL ASSIST","INVENTORY SPECIALIST/SPECIAL ASSISTANT  "
"INVESTIGATIVE ASSOCIATE","INVESTIGATIVE ASSOCIATE  "
"INVESTIGATOR,OVERSIGHT & INVES","INVESTIGATOR,OVERSIGHT AND INVESTIGATIONS "
"ISSUES DIRECTOR","ISSUES DIRECTOR  "
"IT ADVOCACY AND OPS MANAGER","INFORMATION TECHNOLOGY ADVOCACY AND OPERATIONS MANAGER  "
"IT DIRECTOR","INFORMATION TECHNOLOGY DIRECTOR  "
"IT SYSTEMS MANAGER","INFORMATION TECHNOLOGY SYSTEMS MANAGER  "
"JOURNAL CLERK","JOURNAL CLERK  "
"JR LEGISLATIVE AIDE","JUNIOR LEGISLATIVE AIDE  "
"JUDICIARY COUNSEL","JUDICIARY COUNSEL  "
"JUNIOR LA AND PRESS ASSISTANT","JUNIORLEGISLATIVE ASSISTANT/PRESS ASSISTANT  "
"JUNIOR PROFESSIONAL STAFF (S)","JUNIOR PROFESSIONAL STAFF (S)  "
"KITSAP COUNTY DIRECTOR","KITSAP COUNTY DIRECTOR  "
"LABOR LIAISON","LABOR LIAISON  "
"LABOR POLICY DIRECTOR","LABOR POLICY DIRECTOR  "
"LAS VEGAS NM FIELD REP","LAS VEGAS NM FIELD DIRECTOR REPRESENTATIVE  "
"LAW REVISION COUNSEL","LAW REVISION COUNSEL  "
"LAWTON FIELD REPRESENTATIVE","LAWTON FIELD DIRECTOR REPRESENTATIVE  "
"LAWTON OFFICE MGR AND CASEWORKER","LAWTON OFFICE MANAGER/CASEWORKER  "
"LC","LEGISLATIVE CORRESPONDENT "
"LC FOR IMMIGRATION & INTL TRAD","LEGISLATIVE CORRESPONDENTFOR IMMIGRATION AND INTERNATIONAL TRAD E "
"LC AND COMMUNICATIONS SPECIALIST","LEGISLATIVE CORRESPONDENT/COMMUNICATIONS SPECIALIST  "
"LC AND LEGISLATIVE ASSISTANT","LEGISLATIVE CORRESPONDENT/LEGISLATIVE ASSISTANT  "
"LC AND SYSTEMS","LEGISLATIVE CORRESPONDENT/SYSTEMS  "
"LC AND SYSTEMS ADMINISTRATOR","LEGISLATIVE CORRESPONDENT/SYSTEMS ADMINISTRATOR  "
"LEAD CASE SPECIALIST","LEAD CASE SPECIALIST  "
"LEG ASST & SYSTEMS ADM","LEGISLATIVE ASSISTANT AND SYSTEMS ADMINISTRATOR  "
"LEG ASST AND DEP PRESS","LEGISLATIVE ASSISTANT/DEPUTY PRESS  "
"LEG ASST AND SUBCMTE ON DAMA","LEGISLATIVE ASSISTANT/SUBCOMMITTEE ON DAMA  "
"LEG ASST AND SUBCMTE ON EO","LEGISLATIVE ASSISTANT/SUBCOMMITTEE ON EO  "
"LEG ASST AND SUBCMTE ON O&I","LEGISLATIVE ASSISTANT/SUBCOMMITTEE ON OVERSIGHT AND INVESTIGATIONS  "
"LEG CORR & DEPUTY PRESS SEC","LEGISLATIVE CORRESPONDENCE AND DEPUTY PRESS SECRETARY  "
"LEG CORRESPONDENT AND ASSISTANT","LEGISLATIVE CORRESPONDENT/ASSISTANT  "
"LEG COUNSEL AND SR POLICY ADVISOR","LEGISLATIVE COUNSEL/SENIOR POLICY ADVISOR  "
"LEGAL COUNSEL AND PARLIAMENTARIAN","LEGAL COUNSEL/PARLIAMENTARIAN  "
"LEGAL FELLOW","LEGAL FELLOW  "
"LEGIS ASST FOR APPROPRIATIONS","LEGISLATIVE ASSISTANT FOR APPROPRIATIONS  "
"LEGIS ASST AND DEP COMM DIR","LEGISLATIVE ASSISTANT/DEPUTY COMMUNICATION DIRECTOR  "
"LEGIS ASST AND LEGIS CORRESPONDENT","LEGISLATIVE ASSISTANT/LEGISLATIVE CORRESPONDENT  "
"LEGIS ASST AND RULES ASSOCIATE","LEGISLATIVE ASSISTANT/RULES ASSOCIATE  "
"LEGIS ASST AND SUBCMTE HEALTH","LEGISLATIVE ASSISTANT/SUBCOMMITTEE HEALTH  "
"LEGIS ASST-INTERGOV’T AFFAIRS","LEGISLATIVE ASSISTANT-INTERGOVERNMENT AFFAIRS  "
"LEGIS ASST-OFFICE MANAGER","LEGISLATIVE ASSISTANT-OFFICE MANAGER  "
"LEGIS CORR AND ONLINE MEDIA","LEGISLATIVE CORRESPONDENT/ONLINE MEDIA  "
"LEGIS CORRES AND LEGIS ASSISTANT","LEGISLATIVE CORRESPONDENT/LEGISLATIVE ASSISTANT  "
"LEGIS CORRES AND ONLINE COMM AIDE","LEGISLATIVE CORRESPONDENT/ONLINE COMMUNICATION AIDE  "
"LEGIS CORRES AND SYSTEMS MANAGER","LEGISLATIVE CORRESPONDENT/SYSTEMS MANAGER  "
"LEGIS CORRESPONDENT AND PRESS ASST","LEGISLATIVE CORRESPONDENT/PRESS ASSISTANT  "
"LEGIS DIR AND PRES SECY","LEGISLATIVE DIRECTOR/PRESS SECRETARY  "
"LEGIS DIR AND SR POLICY ADV","LEGISLATIVE DIRECTOR/SENIOR POLICY ADVISOR  "
"LEGIS DIRECTOR & LEGAL COUNSEL","LEGISLATIVE DIRECTOR AND LEGAL COUNSEL  "
"LEGIS. ASST-HIGHWAYS & TRAN SC","LEGISLATIVE ASSISTANT-HIGHWAYS AND TRAN SUBCOMMITTEE  "
"LEGIS. CORRES AND DISTRICT SCHED","LEGISLATIVE CORRESPONDENT/DISTRICT SCHEDUCATION  "
"LEGIS. CORRESPONDENCE MANAGER","LEGISLATIVE CORRESPONDENCE MANAGER  "
"LEGISLATIVE & TECH CORR","LEGISLATIVE AND TECHNICAL CORRESPONDENCE  "
"LEGISLATIVE AIDE AND SYSTEMS ADMIN","LEGISLATIVE AIDE/SYSTEMS ADMINISTRATOR  "
"LEGISLATIVE ASSIST AND LEGAL COUNS","LEGISLATIVE ASSISTANT/LEGAL COUNS  "
"LEGISLATIVE ASSIST AND SYS ADMINIS","LEGISLATIVE ASSISTANT/SYSTEMS ADMINIS  "
"LEGISLATIVE ASSISTANT AND CASEWORK","LEGISLATIVE ASSISTANT/CASEWORK  "
"LEGISLATIVE ASSISTANT AND LEG. COR","LEGISLATIVE ASSISTANT/LEGISLATIVE CORRESPONDENT "
"LEGISLATIVE ASSISTANT AND PRESS SE","LEGISLATIVE ASSISTANT/PRESS SECRETARY  "
"LEGISLATIVE ASSISTANT AND SCHEDULE","LEGISLATIVE ASSISTANT/SCHEDULE  "
"LEGISLATIVE ASSISTANT AND SYSTEMS","LEGISLATIVE ASSISTANT/SYSTEMS  "
"LEGISLATIVE ASST & COUNSEL","LEGISLATIVE ASSISTANT AND COUNSEL  "
"LEGISLATIVE ASST & DEPUTY PRES","LEGISLATIVE ASSISTANT AND DEPUTY PRESS  "
"LEGISLATIVE ASST & SYS ADMIN","LEGISLATIVE ASSISTANT AND SYSTEMS ADMINISTRATOR  "
"LEGISLATIVE ASST AND LEGIS CLERK","LEGISLATIVE ASSISTANT/LEGISLATIVE CLERK  "
"LEGISLATIVE ASST AND SYSTEMS ADMIN","LEGISLATIVE ASSISTANT/SYSTEMS ADMINISTRATOR  "
"LEGISLATIVE ASST-AVIATION SUB.","LEGISLATIVE ASSISTANT-AVIATION SUBCOMMITTEE  "
"LEGISLATIVE CLERK,F.C.","LEGISLATIVE CLERK,FULL COMMITTEE  "
"LEGISLATIVE CORR AND EXEC. AIDE","LEGISLATIVE CORRESPONDENT/ EXECUTIVE AIDE  "
"LEGISLATIVE CORRES AND ASST PRESS","LEGISLATIVE CORRESPONDENT/ASSISTANT PRESS  "
"LEGISLATIVE CORRES AND LEGIS ASST","LEGISLATIVE CORRESPONDENT/LEGISLATIVE ASSISTANT  "
"LEGISLATIVE CORRESPOND AND SHARED","LEGISLATIVE CORRESPOND/SHARED "
"LEGISLATIVE CORRESPONDENT AND AIDE","LEGISLATIVE CORRESPONDENT/AIDE  "
"LEGISLATIVE COUNSEL AND DIRECTOR","LEGISLATIVE COUNSEL/DIRECTOR  "
"LEGISLATIVE DIR AND CHIEF COUNSEL","LEGISLATIVE DIRECTOR/CHIEF COUNSEL  "
"LEGISLATIVE DIR AND DEFENSE ADVISO","LEGISLATIVE DIRECTOR/DEFENSE ADVISOR R "
"LEGISLATIVE DIR AND DEPUTY COS","LEGISLATIVE DIRECTOR/DEPUTY CHIEF OF STAFF  "
"LEGISLATIVE DIRECTOR AND COUNSEL","LEGISLATIVE DIRECTOR/COUNSEL  "
"LEGISLATIVE DIRECTOR AND SYST MGR","LEGISLATIVE DIRECTOR/SYTEMS MANAGER  "
"LEGISLATIVE OPERATIONS ADVISOR","LEGISLATIVE OPERATIONS ADVISOR  "
"LEGISLATIVE REPRESENTATIVE","LEGISLATIVE REPRESENTATIVE  "
"LEGISLATIVE RESEARCH DIRECTOR","LEGISLATIVE RESEARCH DIRECTOR  "
"LEGISLATIVE SPECIAL ASSISTANT","LEGISLATIVE SPECIAL ASSISTANT  "
"LEGISLATIVE STAFF ASST (MIN)","LEGISLATIVE STAFF ASSISTANT (MINORITY)  "
"LEGISLATIVE AND EXECUTIVE ASSISTAN","LEGISLATIVE/EXECUTIVE ASSISTANT  "
"LIAISON AND CASEWORKER","LIAISON/CASEWORKER  "
"LIBRARY CLERK","LIBRARY CLERK  "
"LOCKSMITH","LOCKSMITH  "
"LOW COUNTRY COORDINATOR","LOW COUNTRY COORDINATOR  "
"MAJ FULL COMM STAFF DIRECTOR","MAJORITY FULL COMMUNICATION STAFF DIRECTOR  "
"MANAGER MODULAR FURNITURE","MANAGER MODULAR FURNITURE  "
"MANAGER OF COMMUNITY RELATIONS","MANAGER OF COMMUNITY RELATIONS  "
"MANAGER PROJECTS & GRANTS","MANAGER PROJECTS AND GRANTS  "
"MANAGER, CABINET","MANAGER, CABINET  "
"MANAGER, CAO FIRST CALL PLUS","MANAGER, CAO FIRST CALL PLUS  "
"MANAGER, CAO HUMAN RESOURCES","MANAGER, CAO HUMAN RESOURCES  "
"MANAGER, CARPET","MANAGER, CARPET  "
"MANAGER, CENT REC & WAREHOUSE","MANAGER, CENT REC AND WAREHOUSE  "
"MANAGER, FINISHING","MANAGER, FINISHING  "
"MANAGER, LOGISTICS","MANAGER, LOGISTICS  "
"MANAGER, NETWORK SYST ENGINEER","MANAGER, NETWORK SYSTEMS ENGINEER  "
"MANAGER, PERFORMANCE & AWARDS","MANAGER, PERFORMANCE AND AWARDS  "
"MANAGER, SALES & CUSTOMER SVC","MANAGER, SALES AND CUSTOMER SERVICE  "
"MANAGER, TECH SOLUTIONS","MANAGER, TECHNICAL SOLUTIONS  "
"MANAGER, UPHOLSTERY AND DRAPERY","MANAGER, UPHOLSTERY/DRAPERY  "
"MANHATTAN COMMUNITY REP (OTHER COMPENSATION)","MANHATTAN COMMUNITY REPRESENTATIVE   "
"MANHATTAN DIRECTOR","MANHATTAN DIRECTOR  "
"MANUSCRIPT EDITOR","MANUSCRIPT EDITOR  "
"MARKETING & INVENTORY MANAGER","MARKETING AND INVENTORY MANAGER  "
"MCALLEN DISTRICT OFFICE STAFF","MCALLEN DISTRICT OFFICE STAFF  "
"MEDIA COORDINATOR","MEDIA COORDINATOR  "
"MEMBER SERVICES MANAGER","MEMBER SERVICES MANAGER  "
"MEMBERS & FAMILY ROOM COORD. (OVERTIME)","MEMBERS AND FAMILY ROOM COORDINATOR   "
"MGR, CHAMBER SUPPORT SERVICES","MANAGER, CHAMBER SUPPORT SERVICES  "
"MGR,REPUB FLOOR INFO SERVICE","MANAGER,REPUBLICAN FLOOR INFORMATION SERVICE  "
"MIDLANDS AREA DIRECTOR","MIDLANDS AREA DIRECTOR  "
"MIL & VETERANS AFFAIRS DIR","MIL AND VETERANS AFFAIRS DIRECTOR  "
"MILITARY & DEFENSE AFFAIRS REP","MILITARY AND DEFENSE AFFAIRS REPRESENTATIVE  "
"MILITARY & VET AFFAIRS LIASION","MILITARY AND VETERAN AFFAIRS LIASION  "
"MILITARY & VETERANS CASEWORKER","MILITARY AND VETERANS CASEWORKER  "
"MILITARY AND VETERAN’S LIAISON","MILITARY AND VETERAN'S LIAISON  "
"MILITARY CASEWORKER","MILITARY CASEWORKER  "
"MIN CNS, ECON DEV, PB & EM SUB","MINORITY CNS, ECONOMIC DEVELOPMENT, PB AND EM SUBCOMMITTEE  "
"MIN DISTINGUISHED PROF STF MEM","MINORITY DISTINGUISHEDUCATION PROFESSIONAL STAFF MEMBER  "
"MIN LEG STF ASST-EC AND DEV & RAIL","MINORITY LEGISLATIVE STAFF ASSISTANT-EC/DEV AND RAIL  "
"MIN LEGIS STAF ASST, COAST GRD","MINORITY LEGISLATIVE STAFF ASSISTANT, COAST GUARD  "
"MIN. LEG ASST, WATER & POWER","MINORITY LEGISLATIVE ASSISTANT, WATER AND POWER  "
"MIN. STF DIR, ENERGY & MINERAL","MINORITY STAFF DIRECTOR, ENERGY AND MINERAL  "
